[{"active_canonical_facility_count":2,"authoritative_source_type_count":2,"candidate_anchor":{"canonical_name":"340 Cumberland Avenue Portland carrier hotel","confidence":0.96,"derivation":"promoted_earlier_finding","evidence_score":94.08,"facility_id":"fac_im3_point_07171975407","source_ids":["src_mca_340_cumberland_carrier_hotel_2022","src_ums_340_cumberland_colocation_20090608"],"when":{"date":"2009-06-08","precision":"day"}},"candidate_generation":2,"census_region":"Northeast","county_fips":"23005","county_name":"Cumberland County","created_at":"2026-09-03T02:00:00Z","first_entry_research_candidate_id":"fer_5807887e30e0ba33dcef","gate_status":{"available_post_periods":15,"available_pre_periods":8,"both_model_gates_pass":true,"evidence_threshold_status":"passed","period_requirement_status":"passed"},"initial_tranche_rank":1,"latest_resolution_state":"unresolved","national_rank":1,"predecessor_count":1,"prior_adjudication_id":"fea_23005_firstlight_brunswick_20110928_rejected","prior_candidate_event_evaluation_id":"tev_0089745fc5f12751bbdd","priority_score":92.73,"priority_tier":"resolution_ready","queue_status":"initial_tranche","record_status":"provisional","region_rank":1,"remaining_findings":["earliest_dated_operational_event","county_inventory_completeness","documented_search_for_earlier_operations"],"required_finding_status":{"county_inventory_completeness":"unresolved","documented_search_for_earlier_operations":"partial","earliest_dated_operational_event":"partial","exact_facility_identity_for_earliest_event":"resolved"},"research_summary":"The prior candidate was rejected after an earlier operation was documented. That earliest documented predecessor is promoted as a new candidate; research must test it against any still-earlier operation and close the county inventory.","resolution_adjudication_id":"fra_23005_cumberland_generation_2","resolution_candidate_id":"frc_51f6e3caa2c03a227686","resolution_objective":"verify_county_first_operational_entry","resolution_status":"evidence_collected","resolution_track":"promote_predecessor","schema_version":"1.0.0","score_components":{"anchor_evidence_quality":94.08,"authoritative_source_diversity":100.0,"inventory_audit_feasibility":86.82,"model_gate_readiness":100.0,"predecessor_promotability":100.0,"required_finding_closure":25.0},"selection_reasons":["resolution_track:promote_predecessor","candidate_passes_model_evidence_and_period_gates","manageable_inventory_audit_scope","multiple_authoritative_source_types","dated_exact_facility_candidate_available"],"state_abbr":"ME","treatment_definition_id":"trt_first_entry_v1","updated_at":"2026-09-03T08:00:00Z"}]
