[{"active_canonical_facility_count":6,"authoritative_source_type_count":2,"candidate_anchor":{"canonical_name":"Meta Eagle Mountain Data Center","confidence":0.99,"derivation":"existing_dated_candidate","evidence_score":98.01,"facility_id":"fac_im3_building_01024051963","source_ids":["src_im3_atlas_20260209","src_meta_utah_online_20210714"],"when":{"date":"2021-07-14","precision":"day"}},"candidate_generation":1,"census_region":"West","county_fips":"49049","county_name":"Utah County","created_at":"2026-09-03T02:00:00Z","first_entry_research_candidate_id":"fer_9b1318a3333e64129c86","gate_status":{"available_post_periods":3,"available_pre_periods":20,"both_model_gates_pass":true,"evidence_threshold_status":"passed","period_requirement_status":"passed"},"national_rank":40,"predecessor_count":0,"prior_adjudication_id":"fea_49049_meta_eagle_mountain_20210714_unresolved","prior_candidate_event_evaluation_id":"tev_b472299d019aa2522ac1","priority_score":79.14,"priority_tier":"resolution_ready","queue_status":"national_backlog","record_status":"provisional","region_rank":10,"remaining_findings":["earliest_dated_operational_event","county_inventory_completeness","documented_search_for_earlier_operations"],"required_finding_status":{"county_inventory_completeness":"unresolved","documented_search_for_earlier_operations":"partial","earliest_dated_operational_event":"partial","exact_facility_identity_for_earliest_event":"resolved"},"research_summary":"A dated exact-facility anchor is retained from the prior adjudication. Research must complete the historical county inventory and conclusive earlier-operation search before first entry can be verified.","resolution_candidate_id":"frc_d03ca635808e3bdaa7a2","resolution_objective":"verify_county_first_operational_entry","resolution_status":"queued","resolution_track":"resolve_existing_anchor","schema_version":"1.0.0","score_components":{"anchor_evidence_quality":98.01,"authoritative_source_diversity":100.0,"inventory_audit_feasibility":65.92,"model_gate_readiness":100.0,"predecessor_promotability":50.0,"required_finding_closure":25.0},"selection_reasons":["resolution_track:resolve_existing_anchor","candidate_passes_model_evidence_and_period_gates","multiple_authoritative_source_types","dated_exact_facility_candidate_available"],"state_abbr":"UT","treatment_definition_id":"trt_first_entry_v1","updated_at":"2026-09-03T02:00:00Z"},{"active_canonical_facility_count":1,"authoritative_source_type_count":3,"candidate_anchor":{"canonical_name":"Strata Networks","confidence":0.98,"derivation":"existing_dated_candidate","evidence_score":96.04,"facility_id":"fac_im3_building_00611308188","source_ids":["src_americanfork_strata_proposal_20220517","src_im3_atlas_20260209","src_strata_data_center_current_2026"],"when":{"date":"2022-05-17","precision":"day"}},"candidate_generation":1,"census_region":"West","county_fips":"49047","county_name":"Uintah County","created_at":"2026-09-03T02:00:00Z","first_entry_research_candidate_id":"fer_41fd2570d9c0b963b84a","gate_status":{"available_post_periods":2,"available_pre_periods":21,"both_model_gates_pass":false,"evidence_threshold_status":"passed","period_requirement_status":"failed"},"national_rank":71,"predecessor_count":0,"prior_adjudication_id":"fea_49047_strata_20220517_unresolved","prior_candidate_event_evaluation_id":"tev_d02b9f6800e666d2e7fe","priority_score":70.66,"priority_tier":"resolution_ready","queue_status":"national_backlog","record_status":"provisional","region_rank":19,"remaining_findings":["earliest_dated_operational_event","county_inventory_completeness","documented_search_for_earlier_operations"],"required_finding_status":{"county_inventory_completeness":"unresolved","documented_search_for_earlier_operations":"partial","earliest_dated_operational_event":"partial","exact_facility_identity_for_earliest_event":"resolved"},"research_summary":"A dated exact-facility anchor is retained from the prior adjudication. Research must complete the historical county inventory and conclusive earlier-operation search before first entry can be verified.","resolution_candidate_id":"frc_c26e6d0e0bd46bca0d08","resolution_objective":"verify_county_first_operational_entry","resolution_status":"queued","resolution_track":"resolve_existing_anchor","schema_version":"1.0.0","score_components":{"anchor_evidence_quality":96.04,"authoritative_source_diversity":100.0,"inventory_audit_feasibility":100.0,"model_gate_readiness":50.0,"predecessor_promotability":50.0,"required_finding_closure":25.0},"selection_reasons":["resolution_track:resolve_existing_anchor","manageable_inventory_audit_scope","multiple_authoritative_source_types","dated_exact_facility_candidate_available"],"state_abbr":"UT","treatment_definition_id":"trt_first_entry_v1","updated_at":"2026-09-03T02:00:00Z"},{"active_canonical_facility_count":6,"authoritative_source_type_count":2,"candidate_anchor":{"canonical_name":"Flexential Salt Lake City - South Valley","confidence":0.99,"derivation":"existing_dated_candidate","evidence_score":98.01,"facility_id":"fac_im3_building_00355926681","source_ids":["src_flexential_soc3_locations_2023","src_im3_atlas_20260209"],"when":{"date":"2023-10-31","precision":"day"}},"candidate_generation":1,"census_region":"West","county_fips":"49035","county_name":"Salt Lake County","created_at":"2026-09-03T02:00:00Z","first_entry_research_candidate_id":"fer_a2d61cb61cf68a5edf54","gate_status":{"available_post_periods":1,"available_pre_periods":22,"both_model_gates_pass":false,"evidence_threshold_status":"passed","period_requirement_status":"failed"},"national_rank":105,"predecessor_count":0,"prior_adjudication_id":"fea_49035_flexential_south_valley_20231031_unresolved","prior_candidate_event_evaluation_id":"tev_f2dbe2de50655b78b682","priority_score":64.14,"priority_tier":"resolution_standard","queue_status":"national_backlog","record_status":"provisional","region_rank":26,"remaining_findings":["earliest_dated_operational_event","county_inventory_completeness","documented_search_for_earlier_operations"],"required_finding_status":{"county_inventory_completeness":"unresolved","documented_search_for_earlier_operations":"partial","earliest_dated_operational_event":"partial","exact_facility_identity_for_earliest_event":"resolved"},"research_summary":"A dated exact-facility anchor is retained from the prior adjudication. Research must complete the historical county inventory and conclusive earlier-operation search before first entry can be verified.","resolution_candidate_id":"frc_1a00cb6c0f71c3ac78b3","resolution_objective":"verify_county_first_operational_entry","resolution_status":"queued","resolution_track":"resolve_existing_anchor","schema_version":"1.0.0","score_components":{"anchor_evidence_quality":98.01,"authoritative_source_diversity":100.0,"inventory_audit_feasibility":65.92,"model_gate_readiness":50.0,"predecessor_promotability":50.0,"required_finding_closure":25.0},"selection_reasons":["resolution_track:resolve_existing_anchor","multiple_authoritative_source_types","dated_exact_facility_candidate_available"],"state_abbr":"UT","treatment_definition_id":"trt_first_entry_v1","updated_at":"2026-09-03T02:00:00Z"},{"active_canonical_facility_count":1,"authoritative_source_type_count":0,"candidate_generation":1,"census_region":"West","county_fips":"49053","county_name":"Washington County","created_at":"2026-09-03T02:00:00Z","first_entry_research_candidate_id":"fer_906bf55bfc6faefd1a89","gate_status":{"available_post_periods":0,"available_pre_periods":0,"both_model_gates_pass":false,"evidence_threshold_status":"not_evaluated","period_requirement_status":"not_evaluated"},"national_rank":205,"predecessor_count":0,"priority_score":20.0,"priority_tier":"resolution_foundational","queue_status":"national_backlog","record_status":"provisional","region_rank":55,"remaining_findings":["earliest_dated_operational_event","exact_facility_identity_for_earliest_event","county_inventory_completeness","documented_search_for_earlier_operations"],"required_finding_status":{"county_inventory_completeness":"unresolved","documented_search_for_earlier_operations":"unresolved","earliest_dated_operational_event":"unresolved","exact_facility_identity_for_earliest_event":"unresolved"},"research_summary":"Completed predecessor research did not establish a dated exact-facility anchor. The successor search must establish that anchor before county inventory closure.","resolution_candidate_id":"frc_49d482d37c7a1e0c5f22","resolution_objective":"verify_county_first_operational_entry","resolution_status":"queued","resolution_track":"establish_anchor","schema_version":"1.0.0","score_components":{"anchor_evidence_quality":0.0,"authoritative_source_diversity":0.0,"inventory_audit_feasibility":100.0,"model_gate_readiness":0.0,"predecessor_promotability":0.0,"required_finding_closure":0.0},"selection_reasons":["resolution_track:establish_anchor","manageable_inventory_audit_scope"],"state_abbr":"UT","treatment_definition_id":"trt_first_entry_v1","updated_at":"2026-09-03T02:00:00Z"}]
