[{"active_canonical_facility_count":6,"authoritative_source_type_count":1,"candidate_anchor":{"canonical_name":"QTS J. Williams Technology Center","confidence":0.99,"derivation":"promoted_earlier_finding","evidence_score":78.41,"facility_id":"fac_qts_overland_park_historic","source_ids":["src_sec_qts_overland_park_20140310"],"when":{"precision":"year","year":2003}},"candidate_generation":2,"census_region":"Midwest","county_fips":"20091","county_name":"Johnson County","created_at":"2026-09-03T02:00:00Z","first_entry_research_candidate_id":"fer_97d88a4291155f49b1bc","gate_status":{"available_post_periods":21,"available_pre_periods":2,"both_model_gates_pass":false,"evidence_threshold_status":"failed","period_requirement_status":"failed"},"national_rank":140,"predecessor_count":1,"prior_adjudication_id":"fea_20091_state_farm_20161103_unresolved","prior_candidate_event_evaluation_id":"tev_42f3b724129962f3f469","priority_score":51.2,"priority_tier":"resolution_standard","queue_status":"national_backlog","record_status":"provisional","region_rank":40,"remaining_findings":["earliest_dated_operational_event","county_inventory_completeness","documented_search_for_earlier_operations"],"required_finding_status":{"county_inventory_completeness":"unresolved","documented_search_for_earlier_operations":"partial","earliest_dated_operational_event":"partial","exact_facility_identity_for_earliest_event":"resolved"},"research_summary":"The prior candidate was rejected after an earlier operation was documented. That earliest documented predecessor is promoted as a new candidate; research must test it against any still-earlier operation and close the county inventory.","resolution_candidate_id":"frc_73b1e2355a99dc106205","resolution_objective":"verify_county_first_operational_entry","resolution_status":"queued","resolution_track":"promote_predecessor","schema_version":"1.0.0","score_components":{"anchor_evidence_quality":78.41,"authoritative_source_diversity":50.0,"inventory_audit_feasibility":65.92,"model_gate_readiness":0.0,"predecessor_promotability":100.0,"required_finding_closure":25.0},"selection_reasons":["resolution_track:promote_predecessor","dated_exact_facility_candidate_available"],"state_abbr":"KS","treatment_definition_id":"trt_first_entry_v1","updated_at":"2026-09-03T02:00:00Z"},{"active_canonical_facility_count":1,"authoritative_source_type_count":0,"candidate_generation":1,"census_region":"Midwest","county_fips":"20051","county_name":"Ellis County","created_at":"2026-09-03T02:00:00Z","first_entry_research_candidate_id":"fer_f7f74f908ca20e63fefe","gate_status":{"available_post_periods":0,"available_pre_periods":0,"both_model_gates_pass":false,"evidence_threshold_status":"not_evaluated","period_requirement_status":"not_evaluated"},"national_rank":183,"predecessor_count":0,"priority_score":20.0,"priority_tier":"resolution_foundational","queue_status":"national_backlog","record_status":"provisional","region_rank":51,"remaining_findings":["earliest_dated_operational_event","exact_facility_identity_for_earliest_event","county_inventory_completeness","documented_search_for_earlier_operations"],"required_finding_status":{"county_inventory_completeness":"unresolved","documented_search_for_earlier_operations":"unresolved","earliest_dated_operational_event":"unresolved","exact_facility_identity_for_earliest_event":"unresolved"},"research_summary":"Completed predecessor research did not establish a dated exact-facility anchor. The successor search must establish that anchor before county inventory closure.","resolution_candidate_id":"frc_221eb8a3840452885cbd","resolution_objective":"verify_county_first_operational_entry","resolution_status":"queued","resolution_track":"establish_anchor","schema_version":"1.0.0","score_components":{"anchor_evidence_quality":0.0,"authoritative_source_diversity":0.0,"inventory_audit_feasibility":100.0,"model_gate_readiness":0.0,"predecessor_promotability":0.0,"required_finding_closure":0.0},"selection_reasons":["resolution_track:establish_anchor","manageable_inventory_audit_scope"],"state_abbr":"KS","treatment_definition_id":"trt_first_entry_v1","updated_at":"2026-09-03T02:00:00Z"}]
