[{"active_canonical_facility_count":5,"authoritative_source_type_count":2,"candidate_anchor":{"canonical_name":"Meta","confidence":0.99,"derivation":"existing_dated_candidate","evidence_score":98.01,"facility_id":"fac_im3_building_00626785488","source_ids":["src_im3_atlas_20260209","src_meta_los_lunas_open_20190207"],"when":{"date":"2019-02-07","precision":"day"}},"candidate_generation":1,"census_region":"West","county_fips":"35061","county_name":"Valencia County","created_at":"2026-09-03T02:00:00Z","first_entry_research_candidate_id":"fer_ddfb2114a2439bb7a2ed","gate_status":{"available_post_periods":5,"available_pre_periods":18,"both_model_gates_pass":true,"evidence_threshold_status":"passed","period_requirement_status":"passed"},"national_rank":36,"predecessor_count":0,"prior_adjudication_id":"fea_35061_meta_los_lunas_20190207_unresolved","prior_candidate_event_evaluation_id":"tev_340e19d1db2811809205","priority_score":79.83,"priority_tier":"resolution_ready","queue_status":"national_backlog","record_status":"provisional","region_rank":8,"remaining_findings":["earliest_dated_operational_event","county_inventory_completeness","documented_search_for_earlier_operations"],"required_finding_status":{"county_inventory_completeness":"unresolved","documented_search_for_earlier_operations":"partial","earliest_dated_operational_event":"partial","exact_facility_identity_for_earliest_event":"resolved"},"research_summary":"A dated exact-facility anchor is retained from the prior adjudication. Research must complete the historical county inventory and conclusive earlier-operation search before first entry can be verified.","resolution_candidate_id":"frc_5ce95016da525e7d3398","resolution_objective":"verify_county_first_operational_entry","resolution_status":"queued","resolution_track":"resolve_existing_anchor","schema_version":"1.0.0","score_components":{"anchor_evidence_quality":98.01,"authoritative_source_diversity":100.0,"inventory_audit_feasibility":69.39,"model_gate_readiness":100.0,"predecessor_promotability":50.0,"required_finding_closure":25.0},"selection_reasons":["resolution_track:resolve_existing_anchor","candidate_passes_model_evidence_and_period_gates","manageable_inventory_audit_scope","multiple_authoritative_source_types","dated_exact_facility_candidate_available"],"state_abbr":"NM","treatment_definition_id":"trt_first_entry_v1","updated_at":"2026-09-03T02:00:00Z"},{"active_canonical_facility_count":8,"authoritative_source_type_count":1,"candidate_anchor":{"canonical_name":"Oso Grande","confidence":0.93,"derivation":"promoted_earlier_finding","evidence_score":91.14,"facility_id":"fac_im3_point_06625492701","source_ids":["src_dcd_oso_albuquerque_opening_20071009","src_oso_grande_current_2026"],"when":{"date":"2007-10-09","precision":"day"}},"candidate_generation":2,"census_region":"West","county_fips":"35001","county_name":"Bernalillo County","created_at":"2026-09-03T02:00:00Z","first_entry_research_candidate_id":"fer_558c390f2f31ca0f860f","gate_status":{"available_post_periods":17,"available_pre_periods":6,"both_model_gates_pass":false,"evidence_threshold_status":"passed","period_requirement_status":"failed"},"national_rank":87,"predecessor_count":1,"prior_adjudication_id":"fea_35001_sandia_2019_rejected","prior_candidate_event_evaluation_id":"tev_d461129aa7b719cb691b","priority_score":67.01,"priority_tier":"resolution_standard","queue_status":"national_backlog","record_status":"provisional","region_rank":22,"remaining_findings":["earliest_dated_operational_event","county_inventory_completeness","documented_search_for_earlier_operations"],"required_finding_status":{"county_inventory_completeness":"unresolved","documented_search_for_earlier_operations":"partial","earliest_dated_operational_event":"partial","exact_facility_identity_for_earliest_event":"resolved"},"research_summary":"The prior candidate was rejected after an earlier operation was documented. That earliest documented predecessor is promoted as a new candidate; research must test it against any still-earlier operation and close the county inventory.","resolution_candidate_id":"frc_9167ded0d65e14f163c2","resolution_objective":"verify_county_first_operational_entry","resolution_status":"queued","resolution_track":"promote_predecessor","schema_version":"1.0.0","score_components":{"anchor_evidence_quality":91.14,"authoritative_source_diversity":50.0,"inventory_audit_feasibility":60.45,"model_gate_readiness":50.0,"predecessor_promotability":100.0,"required_finding_closure":25.0},"selection_reasons":["resolution_track:promote_predecessor","dated_exact_facility_candidate_available"],"state_abbr":"NM","treatment_definition_id":"trt_first_entry_v1","updated_at":"2026-09-03T02:00:00Z"},{"active_canonical_facility_count":1,"authoritative_source_type_count":2,"candidate_anchor":{"canonical_name":"John F. Simms Building","confidence":0.99,"derivation":"existing_dated_candidate","evidence_score":78.41,"facility_id":"fac_im3_building_00318069356","source_ids":["src_nm_doit_simms_current_2026","src_nm_lfc_simms_data_center_fy2008"],"when":{"precision":"year","year":2007}},"candidate_generation":1,"census_region":"West","county_fips":"35049","county_name":"Santa Fe County","created_at":"2026-09-03T02:00:00Z","first_entry_research_candidate_id":"fer_5374b0ee1bc9075eace4","gate_status":{"available_post_periods":17,"available_pre_periods":6,"both_model_gates_pass":false,"evidence_threshold_status":"failed","period_requirement_status":"failed"},"national_rank":133,"predecessor_count":0,"prior_adjudication_id":"fea_35049_simms_2007_unresolved","prior_candidate_event_evaluation_id":"tev_e545608df947bf28dc6c","priority_score":53.01,"priority_tier":"resolution_standard","queue_status":"national_backlog","record_status":"provisional","region_rank":34,"remaining_findings":["earliest_dated_operational_event","county_inventory_completeness","documented_search_for_earlier_operations"],"required_finding_status":{"county_inventory_completeness":"unresolved","documented_search_for_earlier_operations":"partial","earliest_dated_operational_event":"partial","exact_facility_identity_for_earliest_event":"resolved"},"research_summary":"A dated exact-facility anchor is retained from the prior adjudication. Research must complete the historical county inventory and conclusive earlier-operation search before first entry can be verified.","resolution_candidate_id":"frc_c7b24f44e630ac8d083e","resolution_objective":"verify_county_first_operational_entry","resolution_status":"queued","resolution_track":"resolve_existing_anchor","schema_version":"1.0.0","score_components":{"anchor_evidence_quality":78.41,"authoritative_source_diversity":100.0,"inventory_audit_feasibility":100.0,"model_gate_readiness":0.0,"predecessor_promotability":50.0,"required_finding_closure":25.0},"selection_reasons":["resolution_track:resolve_existing_anchor","manageable_inventory_audit_scope","multiple_authoritative_source_types","dated_exact_facility_candidate_available"],"state_abbr":"NM","treatment_definition_id":"trt_first_entry_v1","updated_at":"2026-09-03T02:00:00Z"},{"active_canonical_facility_count":1,"authoritative_source_type_count":0,"candidate_generation":1,"census_region":"West","county_fips":"35013","county_name":"Doña Ana County","created_at":"2026-09-03T02:00:00Z","first_entry_research_candidate_id":"fer_b0de8a3ff41388fe7560","gate_status":{"available_post_periods":0,"available_pre_periods":0,"both_model_gates_pass":false,"evidence_threshold_status":"not_evaluated","period_requirement_status":"not_evaluated"},"national_rank":194,"predecessor_count":0,"priority_score":20.0,"priority_tier":"resolution_foundational","queue_status":"national_backlog","record_status":"provisional","region_rank":51,"remaining_findings":["earliest_dated_operational_event","exact_facility_identity_for_earliest_event","county_inventory_completeness","documented_search_for_earlier_operations"],"required_finding_status":{"county_inventory_completeness":"unresolved","documented_search_for_earlier_operations":"unresolved","earliest_dated_operational_event":"unresolved","exact_facility_identity_for_earliest_event":"unresolved"},"research_summary":"Completed predecessor research did not establish a dated exact-facility anchor. The successor search must establish that anchor before county inventory closure.","resolution_candidate_id":"frc_603c53c81f4735ccbe20","resolution_objective":"verify_county_first_operational_entry","resolution_status":"queued","resolution_track":"establish_anchor","schema_version":"1.0.0","score_components":{"anchor_evidence_quality":0.0,"authoritative_source_diversity":0.0,"inventory_audit_feasibility":100.0,"model_gate_readiness":0.0,"predecessor_promotability":0.0,"required_finding_closure":0.0},"selection_reasons":["resolution_track:establish_anchor","manageable_inventory_audit_scope"],"state_abbr":"NM","treatment_definition_id":"trt_first_entry_v1","updated_at":"2026-09-03T02:00:00Z"}]
