[{"active_canonical_facility_count":1,"authoritative_source_type_count":1,"candidate_anchor":{"canonical_name":"State of Montana Data Center","confidence":0.99,"derivation":"existing_dated_candidate","evidence_score":93.11,"facility_id":"fac_im3_building_01417637306","source_ids":["src_montana_biennial_miles_city_2015","src_montana_dli_miles_city_construction_2009"],"when":{"date":"2012-04-01","precision":"month"}},"candidate_generation":1,"census_region":"West","county_fips":"30017","county_name":"Custer County","created_at":"2026-09-03T02:00:00Z","first_entry_research_candidate_id":"fer_15624cebe66ba2228517","gate_status":{"available_post_periods":12,"available_pre_periods":11,"both_model_gates_pass":true,"evidence_threshold_status":"passed","period_requirement_status":"passed"},"national_rank":36,"predecessor_count":0,"prior_adjudication_id":"fea_30017_mcdc_201204_unresolved","prior_candidate_event_evaluation_id":"tev_97047321a11e8b2e88bc","priority_score":80.22,"priority_tier":"resolution_ready","queue_status":"national_backlog","record_status":"provisional","region_rank":7,"remaining_findings":["earliest_dated_operational_event","county_inventory_completeness","documented_search_for_earlier_operations"],"required_finding_status":{"county_inventory_completeness":"unresolved","documented_search_for_earlier_operations":"partial","earliest_dated_operational_event":"partial","exact_facility_identity_for_earliest_event":"resolved"},"research_summary":"A dated exact-facility anchor is retained from the prior adjudication. Research must complete the historical county inventory and conclusive earlier-operation search before first entry can be verified.","resolution_candidate_id":"frc_88f994cc34f86eaf5735","resolution_objective":"verify_county_first_operational_entry","resolution_status":"queued","resolution_track":"resolve_existing_anchor","schema_version":"1.0.0","score_components":{"anchor_evidence_quality":93.11,"authoritative_source_diversity":50.0,"inventory_audit_feasibility":100.0,"model_gate_readiness":100.0,"predecessor_promotability":50.0,"required_finding_closure":25.0},"selection_reasons":["resolution_track:resolve_existing_anchor","candidate_passes_model_evidence_and_period_gates","manageable_inventory_audit_scope","dated_exact_facility_candidate_available"],"state_abbr":"MT","treatment_definition_id":"trt_first_entry_v1","updated_at":"2026-09-03T02:00:00Z"},{"active_canonical_facility_count":1,"authoritative_source_type_count":0,"candidate_generation":1,"census_region":"West","county_fips":"30039","county_name":"Granite County","created_at":"2026-09-03T02:00:00Z","first_entry_research_candidate_id":"fer_4ae5c663850b5d2e9f87","gate_status":{"available_post_periods":0,"available_pre_periods":0,"both_model_gates_pass":false,"evidence_threshold_status":"not_evaluated","period_requirement_status":"not_evaluated"},"national_rank":190,"predecessor_count":0,"priority_score":20.0,"priority_tier":"resolution_foundational","queue_status":"national_backlog","record_status":"provisional","region_rank":50,"remaining_findings":["earliest_dated_operational_event","exact_facility_identity_for_earliest_event","county_inventory_completeness","documented_search_for_earlier_operations"],"required_finding_status":{"county_inventory_completeness":"unresolved","documented_search_for_earlier_operations":"unresolved","earliest_dated_operational_event":"unresolved","exact_facility_identity_for_earliest_event":"unresolved"},"research_summary":"Completed predecessor research did not establish a dated exact-facility anchor. The successor search must establish that anchor before county inventory closure.","resolution_candidate_id":"frc_ca7da59e598f741b0eee","resolution_objective":"verify_county_first_operational_entry","resolution_status":"queued","resolution_track":"establish_anchor","schema_version":"1.0.0","score_components":{"anchor_evidence_quality":0.0,"authoritative_source_diversity":0.0,"inventory_audit_feasibility":100.0,"model_gate_readiness":0.0,"predecessor_promotability":0.0,"required_finding_closure":0.0},"selection_reasons":["resolution_track:establish_anchor","manageable_inventory_audit_scope"],"state_abbr":"MT","treatment_definition_id":"trt_first_entry_v1","updated_at":"2026-09-03T02:00:00Z"}]
