[{"active_canonical_facility_count":1,"authoritative_source_type_count":3,"candidate_anchor":{"canonical_name":"TierPoint","confidence":0.96,"derivation":"existing_dated_candidate","evidence_score":94.08,"facility_id":"fac_im3_building_00211832626","source_ids":["src_im3_atlas_20260209","src_maine_tierpoint_soc_bridge_20191031","src_tierpoint_boston_andover_current_2026"],"when":{"date":"2019-10-31","precision":"day"}},"candidate_generation":1,"census_region":"Northeast","county_fips":"25009","county_name":"Essex County","created_at":"2026-09-03T02:00:00Z","first_entry_research_candidate_id":"fer_d878ab1c8c26be460bd7","gate_status":{"available_post_periods":5,"available_pre_periods":18,"both_model_gates_pass":true,"evidence_threshold_status":"passed","period_requirement_status":"passed"},"initial_tranche_rank":9,"national_rank":9,"predecessor_count":0,"prior_adjudication_id":"fea_25009_tierpoint_andover_20191031_unresolved","prior_candidate_event_evaluation_id":"tev_f877693d8c32cc082f2c","priority_score":85.36,"priority_tier":"resolution_ready","queue_status":"initial_tranche","record_status":"provisional","region_rank":3,"remaining_findings":["earliest_dated_operational_event","county_inventory_completeness","documented_search_for_earlier_operations"],"required_finding_status":{"county_inventory_completeness":"unresolved","documented_search_for_earlier_operations":"partial","earliest_dated_operational_event":"partial","exact_facility_identity_for_earliest_event":"resolved"},"research_summary":"A dated exact-facility anchor is retained from the prior adjudication. Research must complete the historical county inventory and conclusive earlier-operation search before first entry can be verified.","resolution_candidate_id":"frc_443a187bb902503dc3c6","resolution_objective":"verify_county_first_operational_entry","resolution_status":"queued","resolution_track":"resolve_existing_anchor","schema_version":"1.0.0","score_components":{"anchor_evidence_quality":94.08,"authoritative_source_diversity":100.0,"inventory_audit_feasibility":100.0,"model_gate_readiness":100.0,"predecessor_promotability":50.0,"required_finding_closure":25.0},"selection_reasons":["resolution_track:resolve_existing_anchor","candidate_passes_model_evidence_and_period_gates","manageable_inventory_audit_scope","multiple_authoritative_source_types","dated_exact_facility_candidate_available"],"state_abbr":"MA","treatment_definition_id":"trt_first_entry_v1","updated_at":"2026-09-03T02:00:00Z"},{"active_canonical_facility_count":2,"authoritative_source_type_count":3,"candidate_anchor":{"canonical_name":"CoreSite BO1 at 70 Inner Belt Road","confidence":0.99,"derivation":"promoted_earlier_finding","evidence_score":97.02,"facility_id":"fac_im3_building_00029827954","source_ids":["src_coresite_424b1_70_innerbelt_20100922","src_coresite_bo1_current_2026","src_somerville_70_innerbelt_history_20180620"],"when":{"date":"2007-04-11","precision":"day"}},"candidate_generation":2,"census_region":"Northeast","county_fips":"25017","county_name":"Middlesex County","created_at":"2026-09-03T02:00:00Z","first_entry_research_candidate_id":"fer_bde7533aacb49a720f30","gate_status":{"available_post_periods":17,"available_pre_periods":6,"both_model_gates_pass":false,"evidence_threshold_status":"passed","period_requirement_status":"failed"},"national_rank":41,"predecessor_count":1,"prior_adjudication_id":"fea_25017_markley_lowell_20151123_rejected","prior_candidate_event_evaluation_id":"tev_3c5835f4aa23d19777f3","priority_score":78.17,"priority_tier":"resolution_ready","queue_status":"national_backlog","record_status":"provisional","region_rank":7,"remaining_findings":["earliest_dated_operational_event","county_inventory_completeness","documented_search_for_earlier_operations"],"required_finding_status":{"county_inventory_completeness":"unresolved","documented_search_for_earlier_operations":"partial","earliest_dated_operational_event":"partial","exact_facility_identity_for_earliest_event":"resolved"},"research_summary":"The prior candidate was rejected after an earlier operation was documented. That earliest documented predecessor is promoted as a new candidate; research must test it against any still-earlier operation and close the county inventory.","resolution_candidate_id":"frc_b4824ac9073dc444ef83","resolution_objective":"verify_county_first_operational_entry","resolution_status":"queued","resolution_track":"promote_predecessor","schema_version":"1.0.0","score_components":{"anchor_evidence_quality":97.02,"authoritative_source_diversity":100.0,"inventory_audit_feasibility":86.82,"model_gate_readiness":50.0,"predecessor_promotability":100.0,"required_finding_closure":25.0},"selection_reasons":["resolution_track:promote_predecessor","manageable_inventory_audit_scope","multiple_authoritative_source_types","dated_exact_facility_candidate_available"],"state_abbr":"MA","treatment_definition_id":"trt_first_entry_v1","updated_at":"2026-09-03T02:00:00Z"}]
