[{"active_canonical_facility_count":1,"authoritative_source_type_count":0,"candidate_generation":1,"census_region":"South","county_fips":"54065","county_name":"Morgan County","created_at":"2026-09-03T02:00:00Z","first_entry_research_candidate_id":"fer_4558917a00b8179cab71","gate_status":{"available_post_periods":0,"available_pre_periods":0,"both_model_gates_pass":false,"evidence_threshold_status":"not_evaluated","period_requirement_status":"not_evaluated"},"national_rank":206,"predecessor_count":0,"priority_score":20.0,"priority_tier":"resolution_foundational","queue_status":"national_backlog","record_status":"provisional","region_rank":65,"remaining_findings":["earliest_dated_operational_event","exact_facility_identity_for_earliest_event","county_inventory_completeness","documented_search_for_earlier_operations"],"required_finding_status":{"county_inventory_completeness":"unresolved","documented_search_for_earlier_operations":"unresolved","earliest_dated_operational_event":"unresolved","exact_facility_identity_for_earliest_event":"unresolved"},"research_summary":"Completed predecessor research did not establish a dated exact-facility anchor. The successor search must establish that anchor before county inventory closure.","resolution_candidate_id":"frc_9587723088000cb9ac31","resolution_objective":"verify_county_first_operational_entry","resolution_status":"queued","resolution_track":"establish_anchor","schema_version":"1.0.0","score_components":{"anchor_evidence_quality":0.0,"authoritative_source_diversity":0.0,"inventory_audit_feasibility":100.0,"model_gate_readiness":0.0,"predecessor_promotability":0.0,"required_finding_closure":0.0},"selection_reasons":["resolution_track:establish_anchor","manageable_inventory_audit_scope"],"state_abbr":"WV","treatment_definition_id":"trt_first_entry_v1","updated_at":"2026-09-03T02:00:00Z"}]
