[{"active_canonical_facility_count":2,"authoritative_source_type_count":2,"candidate_anchor":{"canonical_name":"Flexential Louisville - East","confidence":0.98,"derivation":"existing_dated_candidate","evidence_score":96.04,"facility_id":"fac_im3_building_00329551673","source_ids":["src_flexential_louisville_acquisition_20170109","src_im3_atlas_20260209"],"when":{"date":"2017-01-09","precision":"day"}},"candidate_generation":1,"census_region":"South","county_fips":"21111","county_name":"Jefferson County","created_at":"2026-09-03T02:00:00Z","first_entry_research_candidate_id":"fer_307bcf413c0c421dec26","gate_status":{"available_post_periods":7,"available_pre_periods":16,"both_model_gates_pass":true,"evidence_threshold_status":"passed","period_requirement_status":"passed"},"initial_tranche_rank":14,"latest_resolution_state":"candidate_rejected_first_entry","national_rank":16,"predecessor_count":0,"prior_adjudication_id":"fea_21111_flexential_louisville_east_20170109_unresolved","prior_candidate_event_evaluation_id":"tev_f537c6b768a7d571d0ba","priority_score":83.02,"priority_tier":"resolution_ready","queue_status":"initial_tranche","record_status":"provisional","region_rank":3,"remaining_findings":["earliest_dated_operational_event","county_inventory_completeness","documented_search_for_earlier_operations"],"required_finding_status":{"county_inventory_completeness":"unresolved","documented_search_for_earlier_operations":"partial","earliest_dated_operational_event":"partial","exact_facility_identity_for_earliest_event":"resolved"},"research_summary":"A dated exact-facility anchor is retained from the prior adjudication. Research must complete the historical county inventory and conclusive earlier-operation search before first entry can be verified.","resolution_adjudication_id":"fra_21111_jefferson_generation_1","resolution_candidate_id":"frc_2aec6f1a8115db0f8192","resolution_objective":"verify_county_first_operational_entry","resolution_status":"evidence_collected","resolution_track":"resolve_existing_anchor","schema_version":"1.0.0","score_components":{"anchor_evidence_quality":96.04,"authoritative_source_diversity":100.0,"inventory_audit_feasibility":86.82,"model_gate_readiness":100.0,"predecessor_promotability":50.0,"required_finding_closure":25.0},"selection_reasons":["resolution_track:resolve_existing_anchor","candidate_passes_model_evidence_and_period_gates","manageable_inventory_audit_scope","multiple_authoritative_source_types","dated_exact_facility_candidate_available"],"state_abbr":"KY","treatment_definition_id":"trt_first_entry_v1","updated_at":"2026-09-03T09:00:00Z"},{"active_canonical_facility_count":1,"authoritative_source_type_count":1,"candidate_anchor":{"canonical_name":"East Kentucky Network Datacenter","confidence":0.98,"derivation":"existing_dated_candidate","evidence_score":96.04,"facility_id":"fac_im3_building_01456953254","source_ids":["src_gearheart_about_data_center_current_2026","src_idi_ekn_data_center_20230501"],"when":{"date":"2023-05-01","precision":"day"}},"candidate_generation":1,"census_region":"South","county_fips":"21071","county_name":"Floyd County","created_at":"2026-09-03T02:00:00Z","first_entry_research_candidate_id":"fer_09b69c5d2b3da8560cd8","gate_status":{"available_post_periods":1,"available_pre_periods":22,"both_model_gates_pass":false,"evidence_threshold_status":"passed","period_requirement_status":"failed"},"national_rank":96,"predecessor_count":0,"prior_adjudication_id":"fea_21071_ekn_20230501_unresolved","prior_candidate_event_evaluation_id":"tev_b15337702cfa472a3424","priority_score":65.66,"priority_tier":"resolution_standard","queue_status":"national_backlog","record_status":"provisional","region_rank":34,"remaining_findings":["earliest_dated_operational_event","county_inventory_completeness","documented_search_for_earlier_operations"],"required_finding_status":{"county_inventory_completeness":"unresolved","documented_search_for_earlier_operations":"partial","earliest_dated_operational_event":"partial","exact_facility_identity_for_earliest_event":"resolved"},"research_summary":"A dated exact-facility anchor is retained from the prior adjudication. Research must complete the historical county inventory and conclusive earlier-operation search before first entry can be verified.","resolution_candidate_id":"frc_60566b93a5a3483c95ce","resolution_objective":"verify_county_first_operational_entry","resolution_status":"queued","resolution_track":"resolve_existing_anchor","schema_version":"1.0.0","score_components":{"anchor_evidence_quality":96.04,"authoritative_source_diversity":50.0,"inventory_audit_feasibility":100.0,"model_gate_readiness":50.0,"predecessor_promotability":50.0,"required_finding_closure":25.0},"selection_reasons":["resolution_track:resolve_existing_anchor","manageable_inventory_audit_scope","dated_exact_facility_candidate_available"],"state_abbr":"KY","treatment_definition_id":"trt_first_entry_v1","updated_at":"2026-09-03T02:00:00Z"}]
