[{"active_canonical_facility_count":1,"authoritative_source_type_count":1,"candidate_anchor":{"canonical_name":"North Dakota State University Computer Center host site","confidence":0.96,"derivation":"promoted_earlier_finding","evidence_score":75.26,"facility_id":"fac_ndsu_university_computer_center_historic","source_ids":["src_ndsu_computer_center_history_1985"],"when":{"precision":"year","year":1985}},"candidate_generation":2,"census_region":"Midwest","county_fips":"38017","county_name":"Cass County","created_at":"2026-09-03T02:00:00Z","first_entry_research_candidate_id":"fer_be52f45028f7d3893db1","gate_status":{"available_post_periods":24,"available_pre_periods":0,"both_model_gates_pass":false,"evidence_threshold_status":"failed","period_requirement_status":"failed"},"national_rank":125,"predecessor_count":1,"prior_adjudication_id":"fea_38017_dcn_2006_rejected","prior_candidate_event_evaluation_id":"tev_779835f7150d5ddbcaa9","priority_score":57.54,"priority_tier":"resolution_standard","queue_status":"national_backlog","record_status":"provisional","region_rank":36,"remaining_findings":["earliest_dated_operational_event","county_inventory_completeness","documented_search_for_earlier_operations"],"required_finding_status":{"county_inventory_completeness":"unresolved","documented_search_for_earlier_operations":"partial","earliest_dated_operational_event":"partial","exact_facility_identity_for_earliest_event":"resolved"},"research_summary":"The prior candidate was rejected after an earlier operation was documented. That earliest documented predecessor is promoted as a new candidate; research must test it against any still-earlier operation and close the county inventory.","resolution_candidate_id":"frc_17b844e683bb7c765417","resolution_objective":"verify_county_first_operational_entry","resolution_status":"queued","resolution_track":"promote_predecessor","schema_version":"1.0.0","score_components":{"anchor_evidence_quality":75.26,"authoritative_source_diversity":50.0,"inventory_audit_feasibility":100.0,"model_gate_readiness":0.0,"predecessor_promotability":100.0,"required_finding_closure":25.0},"selection_reasons":["resolution_track:promote_predecessor","manageable_inventory_audit_scope","dated_exact_facility_candidate_available"],"state_abbr":"ND","treatment_definition_id":"trt_first_entry_v1","updated_at":"2026-09-03T02:00:00Z"}]
